{
  "packId": "11111111-1111-1111-1111-111111111111",
  "runId": "run-123",
  "nodeId": "coder.frontend",
  "createdAt": "2026-01-13T00:00:00.000Z",
  "goal": "Implement websocket reconnect backoff per /docs/ACCEPTANCE.md.",
  "definitionOfDone": [
    "All tests pass",
    "Backoff policy matches docs",
    "Docs updated if behavior changes"
  ],
  "globalMode": "implementation",
  "nodeMode": "auto",
  "docsRoot": "/docs",
  "docRefs": [
    {
      "path": "/docs/ACCEPTANCE.md",
      "anchors": ["websocket", "reconnect"],
      "priority": "high"
    },
    {
      "path": "/docs/ARCHITECTURE.md",
      "anchors": ["realtime"],
      "priority": "high"
    }
  ],
  "repoFacts": {
    "language": "typescript",
    "packageManager": "pnpm",
    "testCommand": "pnpm test"
  },
  "workspace": {
    "mode": "worktree",
    "rootPath": ".vuhlp/workspaces",
    "worktreePath": ".vuhlp/workspaces/run-123/coder.frontend"
  },
  "relevantFiles": [
    {
      "path": "src/ws/client.ts",
      "purpose": "Websocket client entrypoint",
      "excerpt": "// connects to server and handles reconnect...",
      "hash": "sha256:..."
    },
    {
      "path": "src/ws/retry.ts",
      "purpose": "Retry/backoff utilities",
      "excerpt": "export function backoff(attempt: number) { ... }"
    }
  ],
  "inputs": [
    {
      "payloadId": "22222222-2222-2222-2222-222222222222",
      "fromNodeId": "verifier.tests",
      "edgeId": "edge.verifier_to_coder"
    }
  ],
  "artifacts": [
    {
      "ref": "artifact://logs/test-failures.txt",
      "type": "log",
      "summary": "2 failing tests: reconnect backoff"
    }
  ],
  "constraints": {
    "noNewDependencies": true,
    "style": "follow existing lint rules"
  },
  "toolPolicy": {
    "approvalMode": "on_request",
    "allowedTools": ["read", "grep", "edit", "bash"]
  },
  "outputSchemaRef": "schema://PatchAndReport/v1"
}
